{
  "selection_protocol_version": 1,
  "workspace_identity_hash": "sha256:dddddddddddddddddddddddddddddddddddddddddddddddddddddddddddddddd",
  "source": {
    "path": "src/unicode.rs",
    "sha256": "sha256:aaaaaaaaaaaaaaaaaaaaaaaaaaaaaaaaaaaaaaaaaaaaaaaaaaaaaaaaaaaaaaaa",
    "byte_length": 128
  },
  "query": {
    "kind": "position",
    "byte_offset": 24,
    "symbol_kind": null
  },
  "server": {
    "configuration_id": null,
    "reported_name": null,
    "reported_version": null,
    "position_encoding": "utf-16"
  },
  "matches": [
    {
      "name": "calculate_rocket_🚀",
      "symbol_kind": "method",
      "symbol_path": ["Engine", "calculate_rocket_🚀"],
      "detail": null,
      "lsp_range": {
        "start": { "line": 2, "character": 4 },
        "end": { "line": 5, "character": 5 }
      },
      "lsp_selection_range": {
        "start": { "line": 2, "character": 7 },
        "end": { "line": 2, "character": 26 }
      },
      "extent": "symbol",
      "selector": { "kind": "bytes", "start": 12, "end": 64 },
      "selected_payload_sha256": "sha256:bbbbbbbbbbbbbbbbbbbbbbbbbbbbbbbbbbbbbbbbbbbbbbbbbbbbbbbbbbbbbbbb",
      "selected_byte_length": 52,
      "request_source": {
        "path": "src/unicode.rs",
        "selector": { "kind": "bytes", "start": 12, "end": 64 },
        "precondition": {
          "kind": "sha256",
          "value": "sha256:aaaaaaaaaaaaaaaaaaaaaaaaaaaaaaaaaaaaaaaaaaaaaaaaaaaaaaaaaaaaaaaa"
        }
      }
    }
  ],
  "warnings": [
    {
      "code": "OBSERVATION_MAY_BE_STALE",
      "message": "no existing srcmv lock coordinated this read-only observation",
      "context": {}
    }
  ]
}
